{
  "claimant": "CDS",
  "subject": {
    "type": "CDS_RECORD_ID",
    "value": "2001192"
  },
  "claim": {
    "predicate": "is_same_as",
    "created": "2015-03-25T11:00:00Z",
    "certainty": 1.0,
    "arguments": {
      "human": 0,
      "actor": "CDS_submission"
    }
  },
  "object": {
    "type": "CDS_REPORT_NUMBER",
    "value": "CMS-PAS-HIG-14-008"
  }
}
