{
  "claimant": "INSPIRE",
  "subject": {
    "type": "INSPIRE_RECORD_ID",
    "value": "cond-mat/9906097"
  },
  "claim": {
    "predicate": "is_cited_by",
    "created": "2015-05-25T11:00:00Z",
    "certainty": 0.5,
    "arguments": {
      "human": 1,
      "actor": "John Doe",
      "role": "cataloguer"
    }
  },
  "object": {
    "type": "CDS_RECORD_ID",
    "value": "2003192"
  }
}
